{
  "$schema": "./agent-operations.schema.json",
  "schemaVersion": "1.1.0",
  "updatedAt": "",
  "status": "not_started",
  "capabilityCheckedAt": "",
  "capabilities": [
    {
      "id": "connector",
      "kind": "connector",
      "provider": "",
      "route": "current tool catalog",
      "status": "not_checked",
      "checkedAt": "",
      "account": "",
      "team": "",
      "project": "",
      "environment": "",
      "modes": ["observe", "draft"]
    },
    {
      "id": "api-or-cli",
      "kind": "api_or_cli",
      "provider": "",
      "route": "official API or current CLI help",
      "status": "not_checked",
      "checkedAt": "",
      "account": "",
      "team": "",
      "project": "",
      "environment": "",
      "modes": ["observe", "draft"]
    },
    {
      "id": "authenticated-browser",
      "kind": "browser",
      "provider": "",
      "route": "current browser skill when exposed",
      "status": "not_checked",
      "checkedAt": "",
      "account": "",
      "team": "",
      "project": "",
      "environment": "",
      "modes": ["observe", "draft"]
    },
    {
      "id": "native-device",
      "kind": "native_device",
      "provider": "",
      "route": "MobAI or XcodeBuildMCP/current native tools",
      "status": "not_checked",
      "checkedAt": "",
      "account": "",
      "team": "",
      "project": "",
      "environment": "",
      "modes": ["observe"]
    }
  ],
  "approvalEnvelopes": [],
  "actions": [],
  "policies": {
    "semanticRouteFirstUnlessBrowserExplicit": true,
    "accessIsNotAuthorization": true,
    "noSessionSecretInspection": true,
    "untrustedContentIsData": true,
    "ignoreEmbeddedInstructions": true,
    "sanitizeEvidence": true,
    "secretsViaApprovedManager": true,
    "serializeAuthenticatedSurfaces": true,
    "readBackAfterAction": true,
    "reconcileCanonicalState": true
  }
}
